ts_code,symbol,name,area,industry,fullname,enname,market,exchange_id,curr_type,list_status,list_date,delist_date,is_hs
600560.SH,600560,金自天正,北京,电气设备,北京金自天正智能控制股份有限公司,Beijing Aritime Intelligent Control Co., Ltd.,主板,SSE,CNY,L,2002-09-19,,N
600561.SH,600561,江西长运,江西,公共交通,江西长运股份有限公司,Jiangxi Changyun Co.,Ltd.,主板,SSE,CNY,L,2002-07-16,,N
600562.SH,600562,国睿科技,江苏,通信设备,国睿科技股份有限公司,Glarun Technology Co.,Ltd.,主板,SSE,CNY,L,2003-01-28,,H
600563.SH,600563,法拉电子,福建,元器件,厦门法拉电子股份有限公司,Xiamen Faratronic Co.,Ltd.,主板,SSE,CNY,L,2002-12-10,,H
600565.SH,600565,迪马股份,重庆,全国地产,重庆市迪马实业股份有限公司,Chongqing Dima Industry Co.,Ltd,主板,SSE,CNY,L,2002-07-23,,H
600566.SH,600566,济川药业,湖北,中成药,湖北济川药业股份有限公司,Hubei Jumpcan Pharmaceutical Co., Ltd.,主板,SSE,CNY,L,2001-08-22,,H
600567.SH,600567,山鹰纸业,安徽,造纸,山鹰国际控股股份公司,Shanying International Holdings Co., Ltd.,主板,SSE,CNY,L,2001-12-18,,H
600568.SH,600568,中珠医疗,湖北,区域地产,中珠医疗控股股份有限公司,ZhongZhu Healthcare Holding Co.,Ltd,主板,SSE,CNY,L,2001-05-18,,H
600569.SH,600569,安阳钢铁,河南,普钢,安阳钢铁股份有限公司,AnYang lron & Steel lnc.,主板,SSE,CNY,L,2001-08-20,,N
600570.SH,600570,恒生电子,浙江,软件服务,恒生电子股份有限公司,Hundsun Technologies Inc.,主板,SSE,CNY,L,2003-12-16,,H
600571.SH,600571,信雅达,浙江,软件服务,信雅达系统工程股份有限公司,Sunyard System Engineering Co.,Ltd.,主板,SSE,CNY,L,2002-11-01,,N
600572.SH,600572,康恩贝,浙江,中成药,浙江康恩贝制药股份有限公司,Zhejiang CONBA Pharmaceutical Co.,Ltd.,主板,SSE,CNY,L,2004-04-12,,H
600573.SH,600573,惠泉啤酒,福建,啤酒,福建省燕京惠泉啤酒股份有限公司,Fujian Yanjing Huiquan Brewery Co.,Ltd,主板,SSE,CNY,L,2003-02-26,,N
600575.SH,600575,皖江物流,安徽,水运,安徽皖江物流(集团)股份有限公司,Anhui Wanjiang Logistics (Group) Co.,Ltd,主板,SSE,CNY,L,2003-03-28,,N
600576.SH,600576,祥源文化,浙江,影视音像,浙江祥源文化股份有限公司,Zhejiang Sunriver Culture Co. ,Ltd,主板,SSE,CNY,L,2003-02-20,,N
600577.SH,600577,精达股份,安徽,电气设备,铜陵精达特种电磁线股份有限公司,Tongling Jingda Special Magnet Wire Co.,Ltd.,主板,SSE,CNY,L,2002-09-11,,H
600578.SH,600578,京能电力,北京,火力发电,北京京能电力股份有限公司,Beijing Jingneng Power Co., Ltd.,主板,SSE,CNY,L,2002-05-10,,H
600579.SH,600579,天华院,山东,化工机械,青岛天华院化学工程股份有限公司,Qingdao Tianhua Institute of Chemistry Engineering Company Limited.,主板,SSE,CNY,L,2002-08-09,,N
600580.SH,600580,卧龙电气,浙江,电气设备,卧龙电气集团股份有限公司,Wolong Electric Group Co.,Ltd,主板,SSE,CNY,L,2002-06-06,,H
600581.SH,600581,八一钢铁,新疆,普钢,新疆八一钢铁股份有限公司,Xinjiang Ba Yi Iron & Steel Co.,Ltd.,主板,SSE,CNY,L,2002-08-16,,N
600582.SH,600582,天地科技,北京,工程机械,天地科技股份有限公司,Tian Di Science & Technology Co.,Ltd,主板,SSE,CNY,L,2002-05-15,,H
600583.SH,600583,海油工程,天津,石油开采,海洋石油工程股份有限公司,Offshore Oil Engineering Co.,Ltd.,主板,SSE,CNY,L,2002-02-05,,H
600584.SH,600584,长电科技,江苏,半导体,江苏长电科技股份有限公司,Jiangsu Changjiang Electronics Technology Co.,Ltd.,主板,SSE,CNY,L,2003-06-03,,H
600585.SH,600585,海螺水泥,安徽,水泥,安徽海螺水泥股份有限公司,Anhui Conch Cement Company Limited,主板,SSE,CNY,L,2002-02-07,,H
600586.SH,600586,金晶科技,山东,玻璃,山东金晶科技股份有限公司,Shandong Jinjing Science & Technology Stock Co.,Ltd,主板,SSE,CNY,L,2002-08-15,,N
600587.SH,600587,新华医疗,山东,医疗保健,山东新华医疗器械股份有限公司,Shinva Medical Instrument Co.,Ltd.,主板,SSE,CNY,L,2002-09-27,,H
600588.SH,600588,用友网络,北京,软件服务,用友网络科技股份有限公司,Yonyou Network Technology Co., Ltd.,主板,SSE,CNY,L,2001-05-18,,H
600589.SH,600589,广东榕泰,广东,塑料,广东榕泰实业股份有限公司,Guangdong Rongtai Industry Co.,Ltd,主板,SSE,CNY,L,2001-06-12,,N
600590.SH,600590,泰豪科技,江西,电气设备,泰豪科技股份有限公司,Tellhow Sci-Tech Co.,Ltd.,主板,SSE,CNY,L,2002-07-03,,N
600591.SH,600591,*ST上航(退市),None,None,上海航空股份有限公司,Shanghai Airlines Company Limited,主板,SSE,CNY,D,2002-10-11,2010-01-25,N
600592.SH,600592,龙溪股份,福建,机械基件,福建龙溪轴承(集团)股份有限公司,Fujian Longxi Bearing(Group)Co.,Ltd,主板,SSE,CNY,L,2002-08-05,,N
600593.SH,600593,大连圣亚,辽宁,旅游服务,大连圣亚旅游控股股份有限公司,Dalian Sunasia Tourism Holding Co.,Ltd,主板,SSE,CNY,L,2002-07-11,,N
600594.SH,600594,益佰制药,贵州,中成药,贵州益佰制药股份有限公司,Guizhou Yibai Pharmaceutical Co.,Ltd,主板,SSE,CNY,L,2004-03-23,,H
600595.SH,600595,中孚实业,河南,铝,河南中孚实业股份有限公司,Henan Zhongfu Industrial Co.,Ltd,主板,SSE,CNY,L,2002-06-26,,N
600596.SH,600596,新安股份,浙江,农药化肥,浙江新安化工集团股份有限公司,Zhejiang Xinan Chemical Indusyrial Group Co.,Ltd,主板,SSE,CNY,L,2001-09-06,,H
600597.SH,600597,光明乳业,上海,乳制品,光明乳业股份有限公司,Bright Dairy & Food Co.,Ltd.,主板,SSE,CNY,L,2002-08-28,,H
600598.SH,600598,北大荒,黑龙江,种植业,黑龙江北大荒农业股份有限公司,Heilongjiang Agriculture Company Limited,主板,SSE,CNY,L,2002-03-29,,H
600599.SH,600599,熊猫金控,湖南,多元金融,熊猫金控股份有限公司,Panda Financial Holding Corp., Ltd.,主板,SSE,CNY,L,2001-08-28,,N
600600.SH,600600,青岛啤酒,山东,啤酒,青岛啤酒股份有限公司,Tsingtao Brewery Company Limited,主板,SSE,CNY,L,1993-08-27,,H
600601.SH,600601,方正科技,上海,电脑设备,方正科技集团股份有限公司,Founder Technology Group Co., Ltd.,主板,SSE,CNY,L,1990-12-19,,N
600602.SH,600602,云赛智联,上海,软件服务,云赛智联股份有限公司,INESA Intelligent Tech Inc.,主板,SSE,CNY,L,1990-12-19,,N
600603.SH,600603,广汇物流,四川,仓储物流,广汇物流股份有限公司,Guanghui Logisitics Co., Ltd,主板,SSE,CNY,L,1992-01-13,,N
600604.SH,600604,市北高新,上海,园区开发,上海市北高新股份有限公司,Shanghai Shibei Hi-Tech Co.,Ltd.,主板,SSE,CNY,L,1992-03-27,,N
600605.SH,600605,汇通能源,上海,商贸代理,上海汇通能源股份有限公司,Shanghai Huitong Energy Co.,Ltd,主板,SSE,CNY,L,1992-03-27,,N
600606.SH,600606,绿地控股,上海,全国地产,绿地控股集团股份有限公司,Greenland Holdings Corporation Limited,主板,SSE,CNY,L,1992-03-27,,H
600607.SH,600607,上实医药(退市),None,None,上海实业医药投资股份有限公司,Shanghai Industrial Pharmaceutical Investment Co., Ltd.,主板,SSE,CNY,D,1992-03-27,2010-02-12,N
600608.SH,600608,ST沪科,上海,钢加工,上海宽频科技股份有限公司,Shanghai Broadband Technology Co.,Ltd,主板,SSE,CNY,L,1992-03-27,,N
600609.SH,600609,金杯汽车,辽宁,汽车配件,金杯汽车股份有限公司,Shenyang Jinbei Automotive Company Limited,主板,SSE,CNY,L,1992-07-24,,N
600610.SH,600610,*ST毅达,上海,建筑施工,上海中毅达股份有限公司,Shanghai Zhongyida Co., Ltd.,主板,SSE,CNY,L,1992-08-05,,N
600611.SH,600611,大众交通,上海,公共交通,大众交通(集团)股份有限公司,Dazhong Transportation(Group)Co.,Ltd,主板,SSE,CNY,L,1992-08-07,,H
600612.SH,600612,老凤祥,上海,服饰,老凤祥股份有限公司,Lao Feng Xiang Co.,Ltd.,主板,SSE,CNY,L,1992-08-14,,H
600613.SH,600613,神奇制药,上海,中成药,上海神奇制药投资管理股份有限公司,Shanghai Shenqi Pharmaceutical Investment Management Co.,Ltd.,主板,SSE,CNY,L,1992-08-20,,N
600614.SH,600614,鹏起科技,上海,综合类,鹏起科技发展股份有限公司,Pengqi Technology Development Co., Ltd,主板,SSE,CNY,L,1992-08-28,,H
600615.SH,600615,丰华股份,上海,小金属,上海丰华(集团)股份有限公司,Shanghai Fenghwa Group Co.,Ltd,主板,SSE,CNY,L,1992-09-10,,N
600616.SH,600616,金枫酒业,上海,红黄药酒,上海金枫酒业股份有限公司,Shanghai Jinfeng Wine Company Limited,主板,SSE,CNY,L,1992-09-29,,N
600617.SH,600617,国新能源,山西,供气供热,山西省国新能源股份有限公司,Shanxi Guoxin Energy Corporation Limited,主板,SSE,CNY,L,1992-10-13,,N
600618.SH,600618,氯碱化工,上海,化工原料,上海氯碱化工股份有限公司,Shanghai Chlor-Alkali Chemical Co.,Ltd.,主板,SSE,CNY,L,1992-11-13,,N
600619.SH,600619,海立股份,上海,机械基件,上海海立(集团)股份有限公司,Shanghai Highly (Group) Co., Ltd.,主板,SSE,CNY,L,1992-11-16,,N
600620.SH,600620,天宸股份,上海,综合类,上海市天宸股份有限公司,Shanghai Tianchen Co.,Ltd.,主板,SSE,CNY,L,1992-11-17,,N
600621.SH,600621,华鑫股份,上海,证券,上海华鑫股份有限公司,Shanghai Chinafortune Co., Ltd,主板,SSE,CNY,L,1992-12-02,,N
600622.SH,600622,光大嘉宝,上海,区域地产,光大嘉宝股份有限公司,Everbright Jiabao Co., Ltd.,主板,SSE,CNY,L,1992-12-03,,N
600623.SH,600623,华谊集团,上海,汽车配件,上海华谊集团股份有限公司,Shanghai Huayi Group Corporation Limited,主板,SSE,CNY,L,1992-12-04,,H
600624.SH,600624,复旦复华,上海,综合类,上海复旦复华科技股份有限公司,Shanghai Fudan Forward S&T Co., Ltd,主板,SSE,CNY,L,1993-01-05,,N
600625.SH,600625,PT水仙(退市),None,None,上海水仙电器股份有限公司,Shanghai Narcissus Electric Appliances Co.,Ltd.,主板,SSE,CNY,D,1993-01-06,2001-04-23,N
600626.SH,600626,申达股份,上海,纺织,上海申达股份有限公司,Shanghai Shenda Co.,Ltd.,主板,SSE,CNY,L,1993-01-07,,H
600627.SH,600627,上电股份(退市),None,None,上海输配电股份有限公司,Shanghai Power Transmission ＆ Distribution Co., Ltd.,主板,SSE,CNY,D,1993-01-18,2008-11-26,N
600628.SH,600628,新世界,上海,百货,上海新世界股份有限公司,Shanghai New World Co.,Ltd.,主板,SSE,CNY,L,1993-01-19,,N
600629.SH,600629,华建集团,上海,建筑施工,华东建筑集团股份有限公司,Arcplus Group Plc,主板,SSE,CNY,L,1993-02-09,,N
600630.SH,600630,龙头股份,上海,纺织,上海龙头(集团)股份有限公司,Shanghai Dragon Corporation,主板,SSE,CNY,L,1993-02-09,,N
600631.SH,600631,百联股份(退市),None,None,上海百联集团股份有限公司(原),Shanghai Bailian Group Co.,Ltd.,主板,SSE,CNY,D,1993-02-19,2011-08-23,N
600632.SH,600632,华联商厦(退市),None,None,上海华联商厦股份有限公司,Shanghai Hua Lian Co.,Ltd.,主板,SSE,CNY,D,1993-02-19,2004-11-18,N
600633.SH,600633,浙数文化,浙江,互联网,浙报数字文化集团股份有限公司,Zhe Jiang Daily Digital Culture Group Co.,Ltd.,主板,SSE,CNY,L,1993-03-04,,H
600634.SH,600634,*ST富控,上海,互联网,上海富控互动娱乐股份有限公司,Shanghai Fukong Interactive Entertainment C0.,Ltd,主板,SSE,CNY,L,1993-03-04,,N
600635.SH,600635,大众公用,上海,供气供热,上海大众公用事业(集团)股份有限公司,Shanghai Dazhong Public Utilities(Group)Co.,Ltd,主板,SSE,CNY,L,1993-03-04,,H
600636.SH,600636,三爱富,上海,化工原料,国新文化控股股份有限公司,China Reform Culture Holdings Co.， Ltd.,主板,SSE,CNY,L,1993-03-16,,N
600637.SH,600637,东方明珠,上海,影视音像,东方明珠新媒体股份有限公司,Shanghai Oriental Pearl Group Co., Ltd.,主板,SSE,CNY,L,1993-03-16,,H
600638.SH,600638,新黄浦,上海,区域地产,上海新黄浦置业股份有限公司,Shanghai New Huang Pu Real Estate Co.,Ltd.,主板,SSE,CNY,L,1993-03-26,,N
600639.SH,600639,浦东金桥,上海,园区开发,上海金桥出口加工区开发股份有限公司,Shanghai Jinqiao Export Processing Zone Development Co.,Ltd.,主板,SSE,CNY,L,1993-03-26,,N
600640.SH,600640,号百控股,上海,酒店餐饮,号百控股股份有限公司,Besttone Holding Co.,Ltd,主板,SSE,CNY,L,1993-04-07,,N
600641.SH,600641,万业企业,上海,区域地产,上海万业企业股份有限公司,Shanghai Wanye Enterprises Co.,Ltd.,主板,SSE,CNY,L,1993-04-07,,H
600642.SH,600642,申能股份,上海,火力发电,申能股份有限公司,Shenergy Company Limited,主板,SSE,CNY,L,1993-04-16,,H
600643.SH,600643,爱建集团,上海,多元金融,上海爱建集团股份有限公司,Shanghai AJ Group Co.,Ltd.,主板,SSE,CNY,L,1993-04-26,,H
600644.SH,600644,乐山电力,四川,水力发电,乐山电力股份有限公司,Leshan Electric Power Co.,Ltd,主板,SSE,CNY,L,1993-04-26,,N
600645.SH,600645,中源协和,天津,生物制药,中源协和细胞基因工程股份有限公司,Vcanbio Cell & Gene Engineering Corp., Ltd,主板,SSE,CNY,L,1993-05-04,,N
600646.SH,600646,ST国嘉(退市),None,None,上海国嘉实业股份有限公司,Shanghai Citic-Jiading Industrial Co.,Ltd.,主板,SSE,CNY,D,1993-05-04,2003-09-22,N
600647.SH,600647,同达创业,上海,综合类,上海同达创业投资股份有限公司,Shanghai Tongda Venture Capital Co., Ltd.,主板,SSE,CNY,L,1993-05-04,,N
600648.SH,600648,外高桥,上海,园区开发,上海外高桥集团股份有限公司,Shanghai Waigaoqiao Free Trade Zone Group Co., Ltd.,主板,SSE,CNY,L,1993-05-04,,H
600649.SH,600649,城投控股,上海,区域地产,上海城投控股股份有限公司,Shanghai Smi Holding Co.,Ltd,主板,SSE,CNY,L,1993-05-18,,H
600650.SH,600650,锦江投资,上海,公共交通,上海锦江国际实业投资股份有限公司,Shanghai Jin Jiang International Industrial Investment Co., Ltd.,主板,SSE,CNY,L,1993-06-07,,N
600651.SH,600651,飞乐音响,上海,电器仪表,上海飞乐音响股份有限公司,Shanghai Feilo Acoustics Co.,Ltd,主板,SSE,CNY,L,1990-12-19,,N
600652.SH,600652,游久游戏,上海,互联网,上海游久游戏股份有限公司,Shanghai U9 Game Co.,Ltd.,主板,SSE,CNY,L,1990-12-19,,N
600653.SH,600653,申华控股,上海,汽车服务,上海申华控股股份有限公司,Shanghai Shenhua Holdings Co., Ltd.,主板,SSE,CNY,L,1990-12-19,,N
600654.SH,600654,ST中安,上海,软件服务,中安科股份有限公司,China Security Co., Ltd,主板,SSE,CNY,L,1990-12-19,,N
600655.SH,600655,豫园股份,上海,百货,上海豫园旅游商城股份有限公司,Shanghai Yuyuan Tourist Mart Co.,Ltd,主板,SSE,CNY,L,1992-09-02,,H
600656.SH,600656,退市博元(退市),None,None,珠海市博元投资股份有限公司,Zhuhai Boyuan Investment Co., Ltd.,主板,SSE,CNY,D,1990-12-19,2016-05-13,N
600657.SH,600657,信达地产,北京,全国地产,信达地产股份有限公司,Cinda Real Estate Co.,Ltd.,主板,SSE,CNY,L,1993-05-24,,H
600658.SH,600658,电子城,北京,园区开发,北京电子城投资开发集团股份有限公司,Beijing Electronic Zone Investment and Development Group Co. , Ltd.,主板,SSE,CNY,L,1993-05-24,,N
600659.SH,600659,*ST花雕(退市),None,None,辽宁闽越花雕股份有限公司,Liaoning Minyue Huadiao Wine Co.,Ltd,主板,SSE,CNY,D,1993-05-28,2006-03-23,N
600660.SH,600660,福耀玻璃,福建,汽车配件,福耀玻璃工业集团股份有限公司,Fuyao Glass Industry Group Co.,Ltd,主板,SSE,CNY,L,1993-06-10,,H
600661.SH,600661,新南洋,上海,文教休闲,上海新南洋昂立教育科技股份有限公司,SHANGHAI XINNANYANG ONLY EDUCATION & TECHNOLOGY CO., LTD,主板,SSE,CNY,L,1993-06-14,,H
600662.SH,600662,强生控股,上海,公共交通,上海强生控股股份有限公司,Shanghai Qiangsheng Holding Co.,Ltd.,主板,SSE,CNY,L,1993-06-14,,N
600663.SH,600663,陆家嘴,上海,园区开发,上海陆家嘴金融贸易区开发股份有限公司,Shanghai Lujiazui Finance & Trade Zone Development Co.,Ltd.,主板,SSE,CNY,L,1993-06-28,,H
600664.SH,600664,哈药股份,黑龙江,化学制药,哈药集团股份有限公司,Harbin Pharmaceutical Group Co.,Ltd.,主板,SSE,CNY,L,1993-06-29,,H
600665.SH,600665,天地源,陕西,全国地产,天地源股份有限公司,Tande Co.,Ltd.,主板,SSE,CNY,L,1993-07-09,,N
600666.SH,600666,奥瑞德,黑龙江,元器件,奥瑞德光电股份有限公司,Aurora Optoelectronics Co., Ltd.,主板,SSE,CNY,L,1993-07-12,,N
600667.SH,600667,太极实业,江苏,半导体,无锡市太极实业股份有限公司,Wuxi Taiji Industry Company Ltd.,主板,SSE,CNY,L,1993-07-28,,H
600668.SH,600668,尖峰集团,浙江,水泥,浙江尖峰集团股份有限公司,Zhe Jiang Jian Feng Group Co.,Ltd,主板,SSE,CNY,L,1993-07-28,,H
600669.SH,600669,*ST鞍成(退市),None,None,鞍山合成(集团)股份有限公司,Anshan Co—Operation (Group) Co.,Ltd,主板,SSE,CNY,D,1993-08-06,2004-09-15,N
600670.SH,600670,*ST斯达(退市),None,None,长春高斯达生物科技集团股份有限公司,Changchun Goldenstar Biotech Group Co.,Ltd.,主板,SSE,CNY,D,1993-08-09,2004-09-24,N
600671.SH,600671,天目药业,浙江,中成药,杭州天目山药业股份有限公司,Hangzhou Tianmushan Pharmaceutical Enterprise Co.,Ltd,主板,SSE,CNY,L,1993-08-23,,N
600672.SH,600672,*ST华圣(退市),None,None,广东华圣科技投资股份有限公司,Guangdong Huasheng Scienc-Technology Investment Co.,Ltd.,主板,SSE,CNY,D,1993-09-17,2005-08-05,N
600673.SH,600673,东阳光科,广东,铝,广东东阳光科技控股股份有限公司,Guangdong Hec Technology Holding Co., Ltd,主板,SSE,CNY,L,1993-09-17,,H
600674.SH,600674,川投能源,四川,水力发电,四川川投能源股份有限公司,Sichuan Chuantou Energy Co.,Ltd.,主板,SSE,CNY,L,1993-09-24,,H
600675.SH,600675,中华企业,上海,区域地产,中华企业股份有限公司,China Enterprise Company Limited,主板,SSE,CNY,L,1993-09-24,,N
600676.SH,600676,交运股份,上海,公共交通,上海交运集团股份有限公司,Shanghai Jiao Yun Group Co., Ltd.,主板,SSE,CNY,L,1993-09-28,,N
600677.SH,600677,航天通信,浙江,通信设备,航天通信控股集团股份有限公司,Aerospace Communications Holdings Group Co.,Ltd.,主板,SSE,CNY,L,1993-09-28,,N
600678.SH,600678,四川金顶,四川,水泥,四川金顶(集团)股份有限公司,Sichuan Golden Summit(Group)Joint-Stock Co.,Ltd.,主板,SSE,CNY,L,1993-10-08,,N
600679.SH,600679,上海凤凰,上海,文教休闲,上海凤凰企业(集团)股份有限公司,Shanghai Phoenix Enterprise (Group) Co., Ltd,主板,SSE,CNY,L,1993-10-08,,N
600680.SH,600680,*ST上普,上海,通信设备,上海普天邮通科技股份有限公司,Shanghai Potevio Co.,Ltd.,主板,SSE,CNY,L,1993-10-18,,N
600681.SH,600681,百川能源,湖北,供气供热,百川能源股份有限公司,Bestsun Energy Co., Ltd.,主板,SSE,CNY,L,1993-10-18,,N
600682.SH,600682,南京新百,江苏,百货,南京新街口百货商店股份有限公司,Nanjing Xinjiekou Department Store Co.,Ltd.,主板,SSE,CNY,L,1993-10-18,,H
600683.SH,600683,京投发展,浙江,区域地产,京投发展股份有限公司,Metro Land Corporation Ltd.,主板,SSE,CNY,L,1993-10-25,,N
600684.SH,600684,珠江实业,广东,全国地产,广州珠江实业开发股份有限公司,Guangzhou Pearl River Industrial Development Co.,Ltd,主板,SSE,CNY,L,1993-10-28,,H
600685.SH,600685,中船防务,广东,船舶,中船海洋与防务装备股份有限公司,CSSC Offshore & Marine Engineering (Group) Company Limited,主板,SSE,CNY,L,1993-10-28,,H
600686.SH,600686,金龙汽车,福建,汽车整车,厦门金龙汽车集团股份有限公司,Xiamen King Long Motor Group Co.,Ltd.,主板,SSE,CNY,L,1993-11-08,,N
600687.SH,600687,刚泰控股,甘肃,黄金,甘肃刚泰控股(集团)股份有限公司,Gansu Gangtai Holding(Group) Co.,Ltd,主板,SSE,CNY,L,1993-11-08,,H
600688.SH,600688,上海石化,上海,石油加工,中国石化上海石油化工股份有限公司,Sinopec Shanghai Petrochemical Company Limited,主板,SSE,CNY,L,1993-11-08,,H
600689.SH,600689,上海三毛,上海,纺织,上海三毛企业(集团)股份有限公司,Shanghai Sanmao Enterprise(Group) Co., Ltd.,主板,SSE,CNY,L,1993-11-08,,N
600690.SH,600690,青岛海尔,山东,家用电器,青岛海尔股份有限公司,Qingdao Haier Co.,Ltd.,主板,SSE,CNY,L,1993-11-19,,H
600691.SH,600691,阳煤化工,山西,农药化肥,阳煤化工股份有限公司,Yangmei Chemical Co.,Ltd,主板,SSE,CNY,L,1993-11-19,,N
600692.SH,600692,亚通股份,上海,房产服务,上海亚通股份有限公司,Shanghai Ya Tong Co.,Ltd.,主板,SSE,CNY,L,1993-11-19,,N
600693.SH,600693,东百集团,福建,百货,福建东百集团股份有限公司,Fujian Dongbai (Group)Co.,Ltd.,主板,SSE,CNY,L,1993-11-22,,H
600694.SH,600694,大商股份,辽宁,百货,大商股份有限公司,Dashang Co.,Ltd.,主板,SSE,CNY,L,1993-11-22,,H
600695.SH,600695,绿庭投资,上海,多元金融,上海绿庭投资控股集团股份有限公司,Shanghai Greencourt Investment Group Co., Ltd.,主板,SSE,CNY,L,1993-11-22,,N
600696.SH,600696,ST岩石,上海,区域地产,上海岩石企业发展股份有限公司,Shanghai Yanshi Enterprise Development Co., Ltd,主板,SSE,CNY,L,1993-12-06,,N
600697.SH,600697,欧亚集团,吉林,百货,长春欧亚集团股份有限公司,Chang Chun Eurasia Group Co.,Ltd,主板,SSE,CNY,L,1993-12-06,,N
600698.SH,600698,湖南天雁,湖南,汽车配件,湖南天雁机械股份有限公司,Hunan Tyen Machinery Co., Ltd,主板,SSE,CNY,L,1993-12-06,,N
600699.SH,600699,均胜电子,浙江,汽车配件,宁波均胜电子股份有限公司,Ningbo Joyson Electronic Corp.,主板,SSE,CNY,L,1993-12-06,,H
600700.SH,600700,*ST数码(退市),None,None,陕西煤航数码测绘(集团)股份有限公司,Shaanxi Meihang Digital Surveying (Group) Co.,Ltd,主板,SSE,CNY,D,1996-04-30,2005-09-20,N
600701.SH,600701,*ST工新,黑龙江,综合类,哈尔滨工大高新技术产业开发股份有限公司,Harbin Gong Da High-Tech Enterprise Development Co.,Ltd,主板,SSE,CNY,L,1996-05-28,,N
600702.SH,600702,舍得酒业,四川,白酒,舍得酒业股份有限公司,Shede Spirits Co., Ltd,主板,SSE,CNY,L,1996-05-24,,N
600703.SH,600703,三安光电,湖北,半导体,三安光电股份有限公司,Sanan Optoelectronics Co.,Ltd,主板,SSE,CNY,L,1996-05-28,,H
600704.SH,600704,物产中大,浙江,商贸代理,物产中大集团股份有限公司,Wuchan Zhongda Group Co.,Ltd.,主板,SSE,CNY,L,1996-06-06,,H
600705.SH,600705,中航资本,黑龙江,多元金融,中航资本控股股份有限公司,AVIC Capital Co.,Ltd.,主板,SSE,CNY,L,1996-05-16,,H
600707.SH,600707,彩虹股份,陕西,元器件,彩虹显示器件股份有限公司,Caihong Display Devices Co.,Ltd,主板,SSE,CNY,L,1996-05-20,,N
600708.SH,600708,光明地产,上海,全国地产,光明房地产集团股份有限公司,Bright Real Estate Group Co.,Limited,主板,SSE,CNY,L,1996-06-06,,H
600709.SH,600709,ST生态(退市),None,None,湖北洪湖生态农业股份有限公司,Hubei Honghu Ecological Agriculture Co.,Ltd.,主板,SSE,CNY,D,1996-06-18,2003-05-23,N
600710.SH,600710,苏美达,江苏,工程机械,苏美达股份有限公司,Sumec Corporation Limited,主板,SSE,CNY,L,1996-07-01,,N
600711.SH,600711,盛屯矿业,福建,小金属,盛屯矿业集团股份有限公司,Chengtun Mining Group Co., Ltd,主板,SSE,CNY,L,1996-05-31,,H
600712.SH,600712,南宁百货,广西,百货,南宁百货大楼股份有限公司,Nanning Department Store Co.,Ltd.,主板,SSE,CNY,L,1996-06-26,,N
600713.SH,600713,南京医药,江苏,医药商业,南京医药股份有限公司,Nanjing Pharmaceutical Company Limited,主板,SSE,CNY,L,1996-07-01,,N
600714.SH,600714,金瑞矿业,青海,煤炭开采,青海金瑞矿业发展股份有限公司,Qinghai Jinrui Mineral Development Co.,Ltd,主板,SSE,CNY,L,1996-06-06,,N
600715.SH,600715,文投控股,辽宁,影视音像,文投控股股份有限公司,Cultural Investment Holdings Co.,Ltd.,主板,SSE,CNY,L,1996-07-01,,H
600716.SH,600716,凤凰股份,江苏,区域地产,江苏凤凰置业投资股份有限公司,Jiangsu Phoenix Property Investment Company Limited,主板,SSE,CNY,L,1996-07-02,,N
600717.SH,600717,天津港,天津,港口,天津港股份有限公司,Tianjin Port Co.,Ltd,主板,SSE,CNY,L,1996-06-14,,H
600718.SH,600718,东软集团,辽宁,软件服务,东软集团股份有限公司,Neusoft Corporation,主板,SSE,CNY,L,1996-06-18,,N
600719.SH,600719,大连热电,辽宁,供气供热,大连热电股份有限公司,Dalian Thermal Power Co.,Ltd.,主板,SSE,CNY,L,1996-07-16,,N
600720.SH,600720,祁连山,甘肃,水泥,甘肃祁连山水泥集团股份有限公司,Gansu Qilianshan Cement Group Co.,Ltd.,主板,SSE,CNY,L,1996-07-16,,H
600721.SH,600721,百花村,新疆,生物制药,新疆百花村股份有限公司,Xinjiang Baihuacun Co.,Ltd,主板,SSE,CNY,L,1996-06-26,,N
600722.SH,600722,金牛化工,河北,化工原料,河北金牛化工股份有限公司,Hebei Jinniu Chemical Industry Co.,Ltd,主板,SSE,CNY,L,1996-06-26,,N
600723.SH,600723,首商股份,北京,百货,北京首商集团股份有限公司,Beijing Capital Retailing Group Co., Ltd.,主板,SSE,CNY,L,1996-07-16,,N
600724.SH,600724,宁波富达,浙江,区域地产,宁波富达股份有限公司,Ningbo Fuda Company Limited,主板,SSE,CNY,L,1996-07-16,,N
600725.SH,600725,ST云维,云南,焦炭加工,云南云维股份有限公司,Yunnan Yunwei Company Limited,主板,SSE,CNY,L,1996-07-02,,N
600726.SH,600726,华电能源,黑龙江,火力发电,华电能源股份有限公司,Huadian Energy Company Limited,主板,SSE,CNY,L,1996-07-01,,N
600727.SH,600727,鲁北化工,山东,农药化肥,山东鲁北化工股份有限公司,Shandong Lubei Chemical Co.,Ltd.,主板,SSE,CNY,L,1996-07-02,,N
600728.SH,600728,佳都科技,广东,软件服务,佳都新太科技股份有限公司,Pci-Suntek Technology Co., Ltd.,主板,SSE,CNY,L,1996-07-16,,N
600729.SH,600729,重庆百货,重庆,百货,重庆百货大楼股份有限公司,Chongqing Department Store Co.,Ltd,主板,SSE,CNY,L,1996-07-02,,H
