ts_code,symbol,name,area,industry,fullname,enname,market,exchange_id,curr_type,list_status,list_date,delist_date,is_hs
002493.SZ,002493,荣盛石化,浙江,化纤,荣盛石化股份有限公司,Rongsheng Petrochemical Co., Ltd.,中小板,SZSE,CNY,L,2010-11-02,,S
002494.SZ,002494,华斯股份,河北,服饰,华斯控股股份有限公司,Huasi Holding Company Limited,中小板,SZSE,CNY,L,2010-11-02,,N
002495.SZ,002495,佳隆股份,广东,食品,广东佳隆食品股份有限公司,Guangdong Jialong Food Co.,Ltd.,中小板,SZSE,CNY,L,2010-11-02,,N
002496.SZ,002496,ST辉丰,江苏,农药化肥,江苏辉丰生物农业股份有限公司,JIANGSU HUIFENG BIO AGRICULTURE CO., LTD.,中小板,SZSE,CNY,L,2010-11-09,,N
002497.SZ,002497,雅化集团,四川,化工原料,四川雅化实业集团股份有限公司,Sichuan Yahua Industrial Group Co.,Ltd.,中小板,SZSE,CNY,L,2010-11-09,,S
002498.SZ,002498,汉缆股份,山东,电气设备,青岛汉缆股份有限公司,Qingdao Hanhe Cable Co., Ltd.,中小板,SZSE,CNY,L,2010-11-09,,S
002499.SZ,002499,科林环保,江苏,环境保护,科林环保装备股份有限公司,Kelin Environmental Protection Equipment,Inc.,中小板,SZSE,CNY,L,2010-11-09,,N
002500.SZ,002500,山西证券,山西,证券,山西证券股份有限公司,Shanxi Securities Co.,Ltd.,中小板,SZSE,CNY,L,2010-11-15,,S
002501.SZ,002501,利源精制,吉林,铝,吉林利源精制股份有限公司,Jilin Liyuan Precision Manufacturing Co., Ltd.,中小板,SZSE,CNY,L,2010-11-17,,S
002502.SZ,002502,骅威文化,广东,影视音像,骅威文化股份有限公司,Huawei Culture Co. , Ltd,中小板,SZSE,CNY,L,2010-11-17,,S
002503.SZ,002503,搜于特,广东,服饰,搜于特集团股份有限公司,SOUYUTE GROUP CO.,LTD.,中小板,SZSE,CNY,L,2010-11-17,,S
002504.SZ,002504,弘高创意,北京,装修装饰,北京弘高创意建筑设计股份有限公司,Beijing Honggao Creative Architectural Design Co.,Ltd.,中小板,SZSE,CNY,L,2010-11-18,,N
002505.SZ,002505,大康农业,湖南,农业综合,湖南大康国际农业食品股份有限公司,Hunan Dakang International Food & Agriculture Co.,Ltd,中小板,SZSE,CNY,L,2010-11-18,,S
002506.SZ,002506,协鑫集成,上海,电气设备,协鑫集成科技股份有限公司,GCL System Integration Technology Co., Ltd.,中小板,SZSE,CNY,L,2010-11-18,,S
002507.SZ,002507,涪陵榨菜,重庆,食品,重庆市涪陵榨菜集团股份有限公司,Chongqing Fuling Zhacai Group Co.,Ltd.,中小板,SZSE,CNY,L,2010-11-23,,S
002508.SZ,002508,老板电器,浙江,家用电器,杭州老板电器股份有限公司,Hangzhou Robam Appliances Co.,Ltd.,中小板,SZSE,CNY,L,2010-11-23,,S
002509.SZ,002509,天广中茂,福建,专用机械,天广中茂股份有限公司,TianGuang ZhongMao Co.,Ltd.,中小板,SZSE,CNY,L,2010-11-23,,S
002510.SZ,002510,天汽模,天津,汽车配件,天津汽车模具股份有限公司,Tianjin Motor Dies Co.,Ltd.,中小板,SZSE,CNY,L,2010-11-25,,N
002511.SZ,002511,中顺洁柔,广东,造纸,中顺洁柔纸业股份有限公司,C&S Paper Co.,Ltd,中小板,SZSE,CNY,L,2010-11-25,,S
002512.SZ,002512,达华智能,广东,元器件,中山达华智能科技股份有限公司,Tatwah Smartech Co., Ltd,中小板,SZSE,CNY,L,2010-12-03,,S
002513.SZ,002513,蓝丰生化,江苏,农药化肥,江苏蓝丰生物化工股份有限公司,Jiangsu Lanfeng Bio-Chemical Co.,Ltd.,中小板,SZSE,CNY,L,2010-12-03,,N
002514.SZ,002514,宝馨科技,江苏,机械基件,苏州宝馨科技实业股份有限公司,Suzhou Boamax Technologies Group Co.,Ltd.,中小板,SZSE,CNY,L,2010-12-03,,N
002515.SZ,002515,金字火腿,浙江,食品,金字火腿股份有限公司,Jinzi Ham Co.,Ltd.,中小板,SZSE,CNY,L,2010-12-03,,S
002516.SZ,002516,旷达科技,江苏,纺织,旷达科技集团股份有限公司,Kuangda Technology Group Co., Ltd.,中小板,SZSE,CNY,L,2010-12-07,,S
002517.SZ,002517,恺英网络,福建,互联网,恺英网络股份有限公司,Kingnet Network Co., Ltd.,中小板,SZSE,CNY,L,2010-12-07,,S
002518.SZ,002518,科士达,深圳,电器仪表,深圳科士达科技股份有限公司,Shenzhen Kstar Science and Technology Co., Ltd.,中小板,SZSE,CNY,L,2010-12-07,,S
002519.SZ,002519,银河电子,江苏,通信设备,江苏银河电子股份有限公司,Jiangsu Yinhe Electronics Co.,Ltd.,中小板,SZSE,CNY,L,2010-12-07,,S
002520.SZ,002520,日发精机,浙江,机床制造,浙江日发精密机械股份有限公司,Zhejiang RIFA Precision Machinery Co.,Ltd.,中小板,SZSE,CNY,L,2010-12-10,,N
002521.SZ,002521,齐峰新材,山东,造纸,齐峰新材料股份有限公司,Qifeng New Material Co.,Ltd.,中小板,SZSE,CNY,L,2010-12-10,,N
002522.SZ,002522,浙江众成,浙江,塑料,浙江众成包装材料股份有限公司,Zhejiang Zhongcheng Packing Material Co., Ltd,中小板,SZSE,CNY,L,2010-12-10,,S
002523.SZ,002523,天桥起重,湖南,工程机械,株洲天桥起重机股份有限公司,Zhuzhou Tianqiao Crane Co., Ltd.,中小板,SZSE,CNY,L,2010-12-10,,N
002524.SZ,002524,光正集团,新疆,供气供热,光正集团股份有限公司,Guangzheng Group Co.,Ltd.,中小板,SZSE,CNY,L,2010-12-17,,N
002526.SZ,002526,山东矿机,山东,工程机械,山东矿机集团股份有限公司,Shandong Mining Machinery Group Co., Ltd.,中小板,SZSE,CNY,L,2010-12-17,,N
002527.SZ,002527,新时达,上海,电器仪表,上海新时达电气股份有限公司,Shanghai STEP Electric Corporation,中小板,SZSE,CNY,L,2010-12-24,,S
002528.SZ,002528,英飞拓,深圳,电脑设备,深圳英飞拓科技股份有限公司,Shenzhen Infinova Limited,中小板,SZSE,CNY,L,2010-12-24,,N
002529.SZ,002529,海源复材,福建,专用机械,福建海源复合材料科技股份有限公司,Fujian Haiyuan Composites Technology Co.,Ltd.,中小板,SZSE,CNY,L,2010-12-24,,N
002530.SZ,002530,金财互联,江苏,专用机械,金财互联控股股份有限公司,JC Finance & Tax Interconnect Holdings Ltd.,中小板,SZSE,CNY,L,2010-12-31,,S
002531.SZ,002531,天顺风能,江苏,电气设备,天顺风能(苏州)股份有限公司,Titan Wind Energy (Suzhou) Co., Ltd,中小板,SZSE,CNY,L,2010-12-31,,S
002532.SZ,002532,新界泵业,浙江,农用机械,新界泵业集团股份有限公司,Shimge Pump Industry Group Co.,Ltd,中小板,SZSE,CNY,L,2010-12-31,,N
002533.SZ,002533,金杯电工,湖南,电气设备,金杯电工股份有限公司,Gold Cup Electric Apparatus Co.,Ltd.,中小板,SZSE,CNY,L,2010-12-31,,N
002534.SZ,002534,杭锅股份,浙江,专用机械,杭州锅炉集团股份有限公司,Hangzhou Boiler Group Co.,Ltd.,中小板,SZSE,CNY,L,2011-01-10,,N
002535.SZ,002535,林州重机,河南,工程机械,林州重机集团股份有限公司,Linzhou Heavy Machinery Group Co., Ltd.,中小板,SZSE,CNY,L,2011-01-11,,N
002536.SZ,002536,西泵股份,河南,汽车配件,河南省西峡汽车水泵股份有限公司,Henan Province Xixia Automobile Water Pump Co.,Ltd.,中小板,SZSE,CNY,L,2011-01-11,,N
002537.SZ,002537,海联金汇,山东,汽车整车,海联金汇科技股份有限公司,Hyunion Holding Co.,Ltd.,中小板,SZSE,CNY,L,2011-01-10,,S
002538.SZ,002538,司尔特,安徽,农药化肥,安徽省司尔特肥业股份有限公司,Anhui Sierte Fertilizer Industry Ltd.,Company,中小板,SZSE,CNY,L,2011-01-18,,N
002539.SZ,002539,云图控股,四川,农药化肥,成都云图控股股份有限公司,Chengdu Wintrue Holding Co., Ltd.,中小板,SZSE,CNY,L,2011-01-18,,N
002540.SZ,002540,亚太科技,江苏,铝,江苏亚太轻合金科技股份有限公司,Jiangsu Asia-Pacific Light Alloy Technology Co., Ltd.,中小板,SZSE,CNY,L,2011-01-18,,S
002541.SZ,002541,鸿路钢构,安徽,钢加工,安徽鸿路钢结构(集团)股份有限公司,Anhui Honglu Steel Construction(Group) Co.,Ltd,中小板,SZSE,CNY,L,2011-01-18,,N
002542.SZ,002542,中化岩土,北京,建筑施工,中化岩土集团股份有限公司,China Zhonghua Geotechnical Engineering Group Co., Ltd.,中小板,SZSE,CNY,L,2011-01-28,,S
002543.SZ,002543,万和电气,广东,家用电器,广东万和新电气股份有限公司,Guangdong Vanward New Electric Co.,Ltd,中小板,SZSE,CNY,L,2011-01-28,,N
002544.SZ,002544,杰赛科技,广东,软件服务,广州杰赛科技股份有限公司,Gci Science & Technology Co., Ltd.,中小板,SZSE,CNY,L,2011-01-28,,S
002545.SZ,002545,东方铁塔,山东,钢加工,青岛东方铁塔股份有限公司,Qingdao East Steel Tower Stock Co.,Ltd,中小板,SZSE,CNY,L,2011-02-11,,S
002546.SZ,002546,新联电子,江苏,电气设备,南京新联电子股份有限公司,Nanjing Xinlian Electronics Co., Ltd.,中小板,SZSE,CNY,L,2011-02-11,,N
002547.SZ,002547,春兴精工,江苏,通信设备,苏州春兴精工股份有限公司,Suzhou Chunxing Precision Mechanical Co.,Ltd.,中小板,SZSE,CNY,L,2011-02-18,,S
002548.SZ,002548,金新农,深圳,饲料,深圳市金新农科技股份有限公司,Shenzhen Jinxinnong Technology Co.,Ltd.,中小板,SZSE,CNY,L,2011-02-18,,N
002549.SZ,002549,凯美特气,湖南,环境保护,湖南凯美特气体股份有限公司,Hunan Kaimeite Gases Co., Ltd.,中小板,SZSE,CNY,L,2011-02-18,,N
002550.SZ,002550,千红制药,江苏,生物制药,常州千红生化制药股份有限公司,Changzhou Qianhong Biopharma Co.,Ltd,中小板,SZSE,CNY,L,2011-02-18,,S
002551.SZ,002551,尚荣医疗,深圳,医疗保健,深圳市尚荣医疗股份有限公司,Shenzhen Glory Medical Co.,Ltd.,中小板,SZSE,CNY,L,2011-02-25,,S
002552.SZ,002552,*ST宝鼎,浙江,机械基件,宝鼎科技股份有限公司,Baoding Technology Co.,Ltd.,中小板,SZSE,CNY,L,2011-02-25,,N
002553.SZ,002553,南方轴承,江苏,汽车配件,江苏南方轴承股份有限公司,Jiangsu Nanfang Bearing Co.,Ltd.,中小板,SZSE,CNY,L,2011-02-25,,N
002554.SZ,002554,惠博普,北京,石油开采,华油惠博普科技股份有限公司,China Oil HBP Science & Technology Co.,Ltd,中小板,SZSE,CNY,L,2011-02-25,,N
002555.SZ,002555,三七互娱,安徽,互联网,芜湖顺荣三七互娱网络科技股份有限公司,WUHU SHUNRONG SANQI INTERACTIVE ENTERTAINMENT NETWORK TECHNOLOGY CO., LTD.,中小板,SZSE,CNY,L,2011-03-02,,S
002556.SZ,002556,辉隆股份,安徽,其他商业,安徽辉隆农资集团股份有限公司,Anhui Huilong Agricultural Means of Production .Co.,Ltd.,中小板,SZSE,CNY,L,2011-03-02,,N
002557.SZ,002557,洽洽食品,安徽,食品,洽洽食品股份有限公司,Chacha Food Company,Limited,中小板,SZSE,CNY,L,2011-03-02,,S
002558.SZ,002558,巨人网络,重庆,互联网,巨人网络集团股份有限公司,Giant Network Group Co., Ltd.,中小板,SZSE,CNY,L,2011-03-02,,S
002559.SZ,002559,亚威股份,江苏,机床制造,江苏亚威机床股份有限公司,Jiangsu Yawei Machine Tool Co.,Ltd.,中小板,SZSE,CNY,L,2011-03-03,,N
002560.SZ,002560,通达股份,河南,电气设备,河南通达电缆股份有限公司,Henan Tong-Da Cable Co., Ltd.,中小板,SZSE,CNY,L,2011-03-03,,N
002561.SZ,002561,徐家汇,上海,百货,上海徐家汇商城股份有限公司,Shanghai Xujiahui Commercial Co., Ltd.,中小板,SZSE,CNY,L,2011-03-03,,N
002562.SZ,002562,兄弟科技,浙江,化学制药,兄弟科技股份有限公司,Brother Enterprises Holding Co.,Ltd.,中小板,SZSE,CNY,L,2011-03-10,,N
002563.SZ,002563,森马服饰,浙江,服饰,浙江森马服饰股份有限公司,Zhejiang Semir Garment Co., Ltd.,中小板,SZSE,CNY,L,2011-03-11,,S
002564.SZ,002564,天沃科技,江苏,化工机械,苏州天沃科技股份有限公司,Suzhou Thvow Technology Co.,Ltd.,中小板,SZSE,CNY,L,2011-03-10,,N
002565.SZ,002565,顺灏股份,上海,造纸,上海顺灏新材料科技股份有限公司,Shanghai Shunho New Materials Technology Co.,Ltd.,中小板,SZSE,CNY,L,2011-03-18,,N
002566.SZ,002566,益盛药业,吉林,中成药,吉林省集安益盛药业股份有限公司,Jilin Jian Yisheng Pharmaceutical Co.,Ltd.,中小板,SZSE,CNY,L,2011-03-18,,N
002567.SZ,002567,唐人神,湖南,饲料,唐人神集团股份有限公司,Tangrenshen Group Co., Ltd,中小板,SZSE,CNY,L,2011-03-25,,N
002568.SZ,002568,百润股份,上海,红黄药酒,上海百润投资控股集团股份有限公司,Shanghai Bairun Investment Holding Group Co., Ltd.,中小板,SZSE,CNY,L,2011-03-25,,S
002569.SZ,002569,步森股份,浙江,服饰,浙江步森服饰股份有限公司,Zhejiang Busen Garments Co.,Ltd.,中小板,SZSE,CNY,L,2011-04-12,,N
002570.SZ,002570,*ST因美,浙江,乳制品,贝因美婴童食品股份有限公司,Beingmate Baby & Child Food Co., Ltd.,中小板,SZSE,CNY,L,2011-04-12,,N
002571.SZ,002571,德力股份,安徽,玻璃,安徽德力日用玻璃股份有限公司,Anhui Deli Household Glass Co.,Ltd.,中小板,SZSE,CNY,L,2011-04-12,,N
002572.SZ,002572,索菲亚,广东,家居用品,索菲亚家居股份有限公司,Suofeiya Home Collection Co.,Ltd,中小板,SZSE,CNY,L,2011-04-12,,S
002573.SZ,002573,清新环境,北京,环境保护,北京清新环境技术股份有限公司,Beijing SPC Environment Protection Tech Co.,Ltd.,中小板,SZSE,CNY,L,2011-04-22,,S
002574.SZ,002574,明牌珠宝,浙江,服饰,浙江明牌珠宝股份有限公司,Zhejiang Ming Jewelry Co.,Ltd.,中小板,SZSE,CNY,L,2011-04-22,,N
002575.SZ,002575,群兴玩具,广东,文教休闲,广东群兴玩具股份有限公司,Guangdong Qunxing Toys Joint-Stock Co.,Ltd,中小板,SZSE,CNY,L,2011-04-22,,N
002576.SZ,002576,通达动力,江苏,电气设备,江苏通达动力科技股份有限公司,Jiangsu Tongda Power Technology Co.,Ltd.,中小板,SZSE,CNY,L,2011-04-28,,N
002577.SZ,002577,雷柏科技,深圳,电脑设备,深圳雷柏科技股份有限公司,Shenzhen Rapoo Technology Co.,Ltd.,中小板,SZSE,CNY,L,2011-04-28,,N
002578.SZ,002578,闽发铝业,福建,铝,福建省闽发铝业股份有限公司,Fujian Minfa Aluminium Co.,Ltd,中小板,SZSE,CNY,L,2011-04-28,,N
002579.SZ,002579,中京电子,广东,元器件,惠州中京电子科技股份有限公司,Huizhou China Eagle Electronic Technology Inc.,中小板,SZSE,CNY,L,2011-05-06,,N
002580.SZ,002580,圣阳股份,山东,电气设备,山东圣阳电源股份有限公司,Shandong Sacred Sun Power Sources Co.,Ltd.,中小板,SZSE,CNY,L,2011-05-06,,N
002581.SZ,002581,未名医药,山东,生物制药,山东未名生物医药股份有限公司,Shandong Sinobioway Biomedicine Co., Ltd.,中小板,SZSE,CNY,L,2011-05-20,,S
002582.SZ,002582,好想你,河南,食品,好想你健康食品股份有限公司,Haoxiangni Health Food Co., Ltd.,中小板,SZSE,CNY,L,2011-05-20,,N
002583.SZ,002583,海能达,深圳,通信设备,海能达通信股份有限公司,Hytera Communications Corporation Limited,中小板,SZSE,CNY,L,2011-05-27,,S
002584.SZ,002584,西陇科学,广东,化工原料,西陇科学股份有限公司,Xilong Scientific Co.,Ltd,中小板,SZSE,CNY,L,2011-06-02,,N
002585.SZ,002585,双星新材,江苏,塑料,江苏双星彩塑新材料股份有限公司,Jiangsu Shuangxing Color Plastic New Materials Co.,Ltd.,中小板,SZSE,CNY,L,2011-06-02,,N
002586.SZ,002586,围海股份,浙江,建筑施工,浙江省围海建设集团股份有限公司,Zhejiang Reclaim Construction Group Co., Ltd.,中小板,SZSE,CNY,L,2011-06-02,,S
002587.SZ,002587,奥拓电子,深圳,元器件,深圳市奥拓电子股份有限公司,Shenzhen Aoto Electronics Co., Ltd.,中小板,SZSE,CNY,L,2011-06-10,,N
002588.SZ,002588,史丹利,山东,农药化肥,史丹利农业集团股份有限公司,STANLEY AGRICULTURE GROUP CO.,LTD.,中小板,SZSE,CNY,L,2011-06-10,,S
002589.SZ,002589,瑞康医药,山东,医药商业,瑞康医药股份有限公司,Realcan Pharmaceutical Co.,Ltd,中小板,SZSE,CNY,L,2011-06-10,,S
002590.SZ,002590,万安科技,浙江,汽车配件,浙江万安科技股份有限公司,Zhejiang Vie Science & Technology Co.,Ltd.,中小板,SZSE,CNY,L,2011-06-10,,N
002591.SZ,002591,恒大高新,江西,化工原料,江西恒大高新技术股份有限公司,Jiangxi Hengda Hi-Tech Co., Ltd.,中小板,SZSE,CNY,L,2011-06-21,,N
002592.SZ,002592,八菱科技,广西,汽车配件,南宁八菱科技股份有限公司,Nanning Baling Technology Co.,Ltd.,中小板,SZSE,CNY,L,2011-11-11,,N
002593.SZ,002593,日上集团,福建,汽车配件,厦门日上集团股份有限公司,Xiamen Sunrise Group Co.,Ltd.,中小板,SZSE,CNY,L,2011-06-28,,N
002594.SZ,002594,比亚迪,深圳,汽车整车,比亚迪股份有限公司,BYD Company Limited,中小板,SZSE,CNY,L,2011-06-30,,S
002595.SZ,002595,豪迈科技,山东,专用机械,山东豪迈机械科技股份有限公司,Himile Mechanical Science and Technology (Shandong) Co.,Ltd,中小板,SZSE,CNY,L,2011-06-28,,S
002596.SZ,002596,海南瑞泽,海南,其他建材,海南瑞泽新型建材股份有限公司,Hainan Ruize New Building Material Co.,Ltd.,中小板,SZSE,CNY,L,2011-07-07,,S
002597.SZ,002597,金禾实业,安徽,化工原料,安徽金禾实业股份有限公司,Anhui Jinhe Industrial Co.,Ltd,中小板,SZSE,CNY,L,2011-07-07,,S
002598.SZ,002598,山东章鼓,山东,机械基件,山东省章丘鼓风机股份有限公司,Shandong Zhangqiu Blower Co.,Ltd.,中小板,SZSE,CNY,L,2011-07-07,,N
002599.SZ,002599,盛通股份,北京,广告包装,北京盛通印刷股份有限公司,Beijing Shengtong Printing Co.,Ltd,中小板,SZSE,CNY,L,2011-07-15,,N
002600.SZ,002600,领益智造,广东,元器件,广东领益智造股份有限公司,Lingyi Itech (Guangdong) Company,中小板,SZSE,CNY,L,2011-07-15,,S
002601.SZ,002601,龙蟒佰利,河南,化工原料,龙蟒佰利联集团股份有限公司,Lomon Billions Group Co.,Ltd.,中小板,SZSE,CNY,L,2011-07-15,,S
002602.SZ,002602,世纪华通,浙江,汽车配件,浙江世纪华通集团股份有限公司,Zhejiang Century Huatong Group Co.,Ltd,中小板,SZSE,CNY,L,2011-07-28,,S
002603.SZ,002603,以岭药业,河北,中成药,石家庄以岭药业股份有限公司,Shijiazhuang Yiling Pharmaceutical Co., Ltd,中小板,SZSE,CNY,L,2011-07-28,,S
002604.SZ,002604,*ST龙力,山东,食品,山东龙力生物科技股份有限公司,Shandong Longlive Bio-Technology Co.,Ltd.,中小板,SZSE,CNY,L,2011-07-28,,N
002605.SZ,002605,姚记扑克,上海,文教休闲,上海姚记扑克股份有限公司,Shanghai Yaoji Playing Card Co., Ltd.,中小板,SZSE,CNY,L,2011-08-05,,N
002606.SZ,002606,大连电瓷,辽宁,电气设备,大连电瓷集团股份有限公司,Dalian Insulator Group Co.,Ltd.,中小板,SZSE,CNY,L,2011-08-05,,N
002607.SZ,002607,亚夏汽车,安徽,汽车服务,亚夏汽车股份有限公司,Yaxia Automobile Corporation,中小板,SZSE,CNY,L,2011-08-10,,N
002608.SZ,002608,江苏国信,江苏,火力发电,江苏国信股份有限公司,Jiangsu Guoxin Corp., Ltd.,中小板,SZSE,CNY,L,2011-08-10,,S
002609.SZ,002609,捷顺科技,深圳,软件服务,深圳市捷顺科技实业股份有限公司,Shenzhen Jieshun Science and Technology Industry Co., Ltd.,中小板,SZSE,CNY,L,2011-08-15,,S
002610.SZ,002610,爱康科技,江苏,电气设备,江苏爱康科技股份有限公司,Jiangsu Akcome Science & Technology Co.,Ltd.,中小板,SZSE,CNY,L,2011-08-15,,S
002611.SZ,002611,东方精工,广东,轻工机械,广东东方精工科技股份有限公司,Guangdong Dongfang Precision Science & Technology Co.,Ltd.,中小板,SZSE,CNY,L,2011-08-30,,S
002612.SZ,002612,朗姿股份,北京,服饰,朗姿股份有限公司,Lancy Co., Ltd,中小板,SZSE,CNY,L,2011-08-30,,N
002613.SZ,002613,北玻股份,河南,专用机械,洛阳北方玻璃技术股份有限公司,Luoyang Northglass Technology Co.,Ltd,中小板,SZSE,CNY,L,2011-08-30,,N
002614.SZ,002614,奥佳华,福建,医疗保健,奥佳华智能健康科技集团股份有限公司,Xiamen Comfort Science&Technology Group Co., Ltd.,中小板,SZSE,CNY,L,2011-09-09,,S
002615.SZ,002615,哈尔斯,浙江,家居用品,浙江哈尔斯真空器皿股份有限公司,Zhejiang Haers Vacuum Containers Co.,Ltd.,中小板,SZSE,CNY,L,2011-09-09,,N
002616.SZ,002616,长青集团,广东,环境保护,广东长青(集团)股份有限公司,Guangdong Chant Group Inc.,中小板,SZSE,CNY,L,2011-09-20,,S
002617.SZ,002617,露笑科技,浙江,电气设备,露笑科技股份有限公司,Roshow Technology Co., Ltd.,中小板,SZSE,CNY,L,2011-09-20,,S
002618.SZ,002618,丹邦科技,深圳,元器件,深圳丹邦科技股份有限公司,Shenzhen Danbond Technology Co.,Ltd.,中小板,SZSE,CNY,L,2011-09-20,,S
002619.SZ,002619,艾格拉斯,浙江,互联网,艾格拉斯股份有限公司,Egls Co.,Ltd.,中小板,SZSE,CNY,L,2011-09-29,,S
002620.SZ,002620,瑞和股份,深圳,装修装饰,深圳瑞和建筑装饰股份有限公司,Shenzhen Ruihe Construction Decoration Co., Ltd.,中小板,SZSE,CNY,L,2011-09-29,,N
002621.SZ,002621,三垒股份,辽宁,专用机械,大连三垒机器股份有限公司,Dalian Sunlight Machinery Co.,Ltd.,中小板,SZSE,CNY,L,2011-09-29,,N
002622.SZ,002622,融钰集团,吉林,电气设备,融钰集团股份有限公司,RONGYU GROUP CO.,LTD.,中小板,SZSE,CNY,L,2011-10-18,,S
002623.SZ,002623,亚玛顿,江苏,玻璃,常州亚玛顿股份有限公司,Changzhou Almaden Co., Ltd.,中小板,SZSE,CNY,L,2011-10-13,,N
002624.SZ,002624,完美世界,浙江,影视音像,完美世界股份有限公司,Perfect World Co., Ltd.,中小板,SZSE,CNY,L,2011-10-28,,S
002625.SZ,002625,光启技术,浙江,汽车配件,光启技术股份有限公司,Kuang-Chi Technologies Co., Ltd.,中小板,SZSE,CNY,L,2011-11-03,,S
002626.SZ,002626,金达威,福建,食品,厦门金达威集团股份有限公司,Xiamen Kingdomway Group Company,中小板,SZSE,CNY,L,2011-10-28,,S
002627.SZ,002627,宜昌交运,湖北,公共交通,湖北宜昌交运集团股份有限公司,Hubei Yichang Transportation Group Co.,Ltd.,中小板,SZSE,CNY,L,2011-11-03,,N
002628.SZ,002628,成都路桥,四川,建筑施工,成都市路桥工程股份有限公司,Chengdu Road & Bridge Engineering Co.,Ltd,中小板,SZSE,CNY,L,2011-11-03,,N
002629.SZ,002629,仁智股份,浙江,石油开采,浙江仁智股份有限公司,Zhejiang Renzhi Co.,Ltd.,中小板,SZSE,CNY,L,2011-11-03,,N
002630.SZ,002630,华西能源,四川,专用机械,华西能源工业股份有限公司,China Western Power Industrial Co., Ltd.,中小板,SZSE,CNY,L,2011-11-11,,S
002631.SZ,002631,德尔未来,江苏,家居用品,德尔未来科技控股集团股份有限公司,Der Future Science & Technology Holding Group Co., Ltd.,中小板,SZSE,CNY,L,2011-11-11,,S
002632.SZ,002632,道明光学,浙江,化工原料,道明光学股份有限公司,Daoming Optics&Chemical Co.,Ltd,中小板,SZSE,CNY,L,2011-11-22,,N
002633.SZ,002633,申科股份,浙江,机械基件,申科滑动轴承股份有限公司,Shenke Slide Bearing Corporation,中小板,SZSE,CNY,L,2011-11-22,,N
002634.SZ,002634,棒杰股份,浙江,服饰,浙江棒杰数码针织品股份有限公司,Zhejiang Bangjie Digital Knitting Share Co.,Ltd.,中小板,SZSE,CNY,L,2011-12-05,,N
002635.SZ,002635,安洁科技,江苏,电脑设备,苏州安洁科技股份有限公司,Suzhou Anjie Technology Co., Ltd.,中小板,SZSE,CNY,L,2011-11-25,,S
002636.SZ,002636,金安国纪,上海,元器件,金安国纪科技股份有限公司,Goldenmax International Technology Ltd.,中小板,SZSE,CNY,L,2011-11-25,,S
002637.SZ,002637,赞宇科技,浙江,日用化工,赞宇科技集团股份有限公司,Zanyu Technology Group Co., Ltd.,中小板,SZSE,CNY,L,2011-11-25,,N
002638.SZ,002638,勤上股份,广东,半导体,东莞勤上光电股份有限公司,Dongguan Kingsun Optoelectronic Co.,Ltd.,中小板,SZSE,CNY,L,2011-11-25,,N
002639.SZ,002639,雪人股份,福建,专用机械,福建雪人股份有限公司,Fujian Snowman Co., Ltd,中小板,SZSE,CNY,L,2011-12-05,,N
002640.SZ,002640,跨境通,山西,服饰,跨境通宝电子商务股份有限公司,Global Top E-Commerce Co.,Ltd.,中小板,SZSE,CNY,L,2011-12-08,,S
002641.SZ,002641,永高股份,浙江,塑料,永高股份有限公司,Yonggao Co., Ltd.,中小板,SZSE,CNY,L,2011-12-08,,N
002642.SZ,002642,荣之联,北京,软件服务,北京荣之联科技股份有限公司,United Electronics Co.,Ltd.,中小板,SZSE,CNY,L,2011-12-20,,S
002643.SZ,002643,万润股份,山东,化工原料,中节能万润股份有限公司,Valiant Co.,Ltd,中小板,SZSE,CNY,L,2011-12-20,,S
002644.SZ,002644,佛慈制药,甘肃,中成药,兰州佛慈制药股份有限公司,Lanzhou Foci Pharmaceutical Co., Ltd.,中小板,SZSE,CNY,L,2011-12-22,,N
002645.SZ,002645,华宏科技,江苏,专用机械,江苏华宏科技股份有限公司,Jiangsu Huahong Technology Co., Ltd.,中小板,SZSE,CNY,L,2011-12-20,,N
002646.SZ,002646,青青稞酒,青海,白酒,青海互助青稞酒股份有限公司,Qinghai Huzhu Barley Wine Co.,Ltd.,中小板,SZSE,CNY,L,2011-12-22,,S
002647.SZ,002647,仁东控股,浙江,多元金融,仁东控股股份有限公司,Rendong Holdings Co., Ltd.,中小板,SZSE,CNY,L,2011-12-28,,N
002648.SZ,002648,卫星石化,浙江,化工原料,浙江卫星石化股份有限公司,Zhejiang Satellite Petrochemical Co., Ltd.,中小板,SZSE,CNY,L,2011-12-28,,S
002649.SZ,002649,博彦科技,北京,软件服务,博彦科技股份有限公司,Beyondsoft Corporation,中小板,SZSE,CNY,L,2012-01-06,,S
002650.SZ,002650,加加食品,湖南,食品,加加食品集团股份有限公司,Jiajia Food Group Co.,Ltd.,中小板,SZSE,CNY,L,2012-01-06,,S
002651.SZ,002651,利君股份,四川,专用机械,成都利君实业股份有限公司,Chengdu Leejun Industrial Co., Ltd.,中小板,SZSE,CNY,L,2012-01-06,,S
002652.SZ,002652,扬子新材,江苏,其他建材,苏州扬子江新型材料股份有限公司,Suzhou Yangtze New Materials Co.,Ltd.,中小板,SZSE,CNY,L,2012-01-19,,N
002653.SZ,002653,海思科,西藏,化学制药,海思科医药集团股份有限公司,Haisco Pharmaceutical Group Co.,Ltd,中小板,SZSE,CNY,L,2012-01-17,,S
002654.SZ,002654,万润科技,深圳,半导体,深圳万润科技股份有限公司,Shenzhen Mason Technologies Co., Ltd.,中小板,SZSE,CNY,L,2012-02-17,,N
002655.SZ,002655,共达电声,山东,元器件,山东共达电声股份有限公司,Shandong Gettop Acoustic Co.,Ltd.,中小板,SZSE,CNY,L,2012-02-17,,N
002656.SZ,002656,摩登大道,广东,服饰,摩登大道时尚集团股份有限公司,Modern Avenue Group Co., Ltd.,中小板,SZSE,CNY,L,2012-02-28,,S
002657.SZ,002657,中科金财,北京,软件服务,北京中科金财科技股份有限公司,Sinodata Co., Ltd.,中小板,SZSE,CNY,L,2012-02-28,,S
